{
  "schema_version": 1,
  "project": "WARP",
  "stage": "2P-E-B-PREBUILT",
  "record_type": "binary-audit-plan-template",
  "status": "PLANNED_NOT_AUTHORIZED",
  "source_decision_record": "client/warp-audit/decisions/core-path-decision-record-2026-07-31.json",
  "upstream_project": "WARP",
  "upstream_commit_pinned": "9b1173e9e4e135c68e150704f01186ab5e763acd",
  "purpose": "Planejar, de forma auditavel, uma futura auditoria binaria OFFLINE do nucleo prebuilt do WARP em etapas pequenas, reproduziveis e bloqueadas por decisoes humanas independentes. Este e um TEMPLATE de plano: nao materializa, nao baixa, nao extrai, nao calcula hash real, nao inspeciona, nao executa e nao autoriza nada.",
  "non_authorization_notice": "A selecao de PREBUILT_PATH (ETAPA 2P-E-A2) autoriza SOMENTE a producao deste plano. Nenhuma autorizacao operacional e concedida aqui. Cada gate exige decisao humana propria e independente. O merge do PR desta etapa nao autoriza nenhuma execucao futura, nem o GATE 1.",
  "non_authorization_chain": [
    "Autorizacao para materializar nao autoriza executar.",
    "Autorizacao para inspecao estatica nao autoriza analise dinamica.",
    "Autorizacao para executar sem cliente nao autoriza fornecer o Ragexe.",
    "Autorizacao para fornecer uma copia descartavel do Ragexe nao autoriza modificar o cliente original.",
    "Autorizacao para avaliar patches nao autoriza aplica-los.",
    "Autorizacao para aplicar um patch nao autoriza outros patches.",
    "Autorizacao para preparar um cliente nao autoriza o primeiro login.",
    "Autorizacao para primeiro login nao autoriza distribuicao publica.",
    "Qualquer gate pode terminar em STOP_PATH.",
    "O merge do PR desta etapa nao autoriza nenhuma execucao futura."
  ],
  "principles": [
    "Offline por padrao.",
    "Minimo privilegio.",
    "Maquina ou sandbox descartavel.",
    "Rede bloqueada.",
    "Evidencia antes de decisao.",
    "Hashes calculados localmente.",
    "Preservacao do artefato original.",
    "Copias de trabalho descartaveis.",
    "Nenhuma alteracao do executavel original.",
    "Nenhum arquivo proprietario no Git.",
    "Decisoes humanas independentes.",
    "Interrupcao automatica em comportamento inesperado.",
    "STOP_PATH valido em qualquer fase.",
    "Nenhuma adaptacao do servidor por tentativa.",
    "Ausencia de confianca implicita no prebuilt."
  ],
  "states": [
    "PLANNED_NOT_AUTHORIZED",
    "WAITING_HUMAN_DECISION",
    "AUTHORIZED_FOR_SINGLE_GATE",
    "IN_PROGRESS",
    "EVIDENCE_COLLECTED",
    "GATE_PASSED",
    "GATE_FAILED",
    "STOPPED",
    "SUPERSEDED"
  ],
  "gates": [
    {
      "gate_id": 0,
      "gate_name": "Reconfirmacao de proveniencia",
      "objective": "Reconfirmar, por metadados e conteudo textual, o repositorio oficial, o commit fixado, o caminho exato do blob prebuilt, a ausencia de alteracao upstream relevante e a licenca e o contexto de distribuicao do WARP.",
      "planned_actions": [
        "reconfirmar o repositorio oficial identificado nas etapas anteriores",
        "reconfirmar o commit fixado por metadados",
        "identificar o caminho exato do blob prebuilt no diretorio de distribuicao Windows do commit",
        "confirmar ausencia de alteracao upstream relevante desde o commit fixado",
        "confirmar a licenca declarada e o contexto de distribuicao"
      ],
      "does_not_materialize_binary": true,
      "required_evidence": [
        "evidencia documental da reconfirmacao (somente metadados e texto)",
        "decisao de continuar ou STOP_PATH"
      ],
      "human_decision_required": true,
      "exit_options": ["CONTINUE", "STOP_PATH"],
      "does_not_authorize": [
        "materializar o binario",
        "executar",
        "fornecer cliente"
      ],
      "must_remain_false": ["materialization_authorized", "execution_without_client_authorized"]
    },
    {
      "gate_id": 1,
      "gate_name": "Autorizacao para materializacao",
      "objective": "Decisao humana exclusiva que podera, no futuro, permitir obter exatamente o blob fixado, sem executar, sem fornecer cliente e sem extrair outros artefatos desnecessarios.",
      "planned_actions": [
        "registrar decisao humana especifica de materializacao futura",
        "delimitar o escopo ao blob fixado exato"
      ],
      "does_not_materialize_binary": true,
      "required_evidence": [
        "registro de decisao do gate (artefato separado)",
        "escopo fechado da materializacao futura"
      ],
      "human_decision_required": true,
      "exit_options": ["AUTHORIZE_MATERIALIZATION", "STOP_PATH"],
      "does_not_authorize": [
        "executar",
        "fornecer cliente",
        "extrair artefatos desnecessarios"
      ],
      "must_remain_false": ["execution_without_client_authorized", "client_copy_provision_authorized"]
    },
    {
      "gate_id": 2,
      "gate_name": "Materializacao e integridade local",
      "objective": "Planejar a obtencao do blob fixado em diretorio descartavel, com integridade calculada localmente e sem qualquer envio externo. Este gate nao autoriza execucao.",
      "planned_actions": [
        "usar diretorio descartavel com permissoes restritas",
        "registrar origem exata, data e operador",
        "registrar tamanho do artefato",
        "calcular SHA-256 localmente com utilitario de hashing",
        "opcionalmente calcular SHA-512 localmente",
        "preservar somente enquanto necessario",
        "nao realizar nenhum upload externo"
      ],
      "does_not_materialize_binary": true,
      "required_evidence": [
        "metadados da materializacao (origem, data, operador, tamanho)",
        "resumo de integridade calculado localmente"
      ],
      "human_decision_required": true,
      "exit_options": ["GATE_PASSED", "GATE_FAILED", "STOP_PATH"],
      "does_not_authorize": ["executar o binario", "enviar o binario a qualquer servico"],
      "must_remain_false": ["execution_without_client_authorized", "external_reputation_upload_authorized"]
    },
    {
      "gate_id": 3,
      "gate_name": "Identidade e assinatura",
      "objective": "Planejar a analise offline de identidade e de assinatura do artefato: nome e formato, tipo PE, arquitetura, timestamp PE (metadado NAO confiavel), versao, informacoes de produto, presenca ou ausencia de assinatura Authenticode, cadeia, validade criptografica, identidade do signatario e alertas.",
      "planned_actions": [
        "descrever nome e formato do artefato",
        "identificar tipo PE e arquitetura",
        "registrar timestamp PE apenas como metadado nao confiavel",
        "registrar versao e informacoes de produto",
        "verificar presenca ou ausencia de assinatura Authenticode com utilitario local",
        "avaliar cadeia, validade criptografica e identidade do signatario",
        "registrar alertas e inconsistencias"
      ],
      "does_not_materialize_binary": true,
      "required_evidence": [
        "descricao de identidade do artefato",
        "resultado de verificacao de assinatura local (a ser preenchido no futuro)"
      ],
      "human_decision_required": true,
      "exit_options": ["GATE_PASSED", "GATE_FAILED", "STOP_PATH"],
      "does_not_authorize": ["executar o binario"],
      "must_remain_false": ["execution_without_client_authorized"],
      "notes": "Ausencia de assinatura NAO deve ser tratada automaticamente como malware, mas aumenta o risco e exige decisao humana."
    },
    {
      "gate_id": 4,
      "gate_name": "Inventario PE estatico",
      "objective": "Planejar inspecao estatica offline do PE, sem execucao.",
      "planned_actions": [
        "inspecionar cabecalhos PE e secoes",
        "avaliar entropia e overlay",
        "listar imports, exports, recursos e manifest",
        "verificar TLS callbacks, relocations, debug directory e certificados",
        "avaliar indicadores de empacotamento e dependencias",
        "extrair strings relevantes e possiveis URLs, dominios ou caminhos embutidos",
        "avaliar privilegios solicitados e mecanismos de persistencia aparentes",
        "avaliar funcoes relacionadas a rede, processo, servico, registro e injecao"
      ],
      "does_not_materialize_binary": true,
      "required_evidence": [
        "inventario PE estatico (a ser preenchido no futuro)",
        "lista de indicadores avaliados"
      ],
      "human_decision_required": true,
      "exit_options": ["GATE_PASSED", "GATE_FAILED", "STOP_PATH"],
      "does_not_authorize": ["executar o binario"],
      "must_remain_false": ["execution_without_client_authorized"],
      "notes": "Nenhuma conclusao deve depender apenas de uma metrica isolada."
    },
    {
      "gate_id": 5,
      "gate_name": "Verificacoes locais de seguranca",
      "objective": "Planejar uso APENAS de mecanismos locais e autorizados (antivirus local, Defender ou equivalente disponivel, ferramentas estaticas locais, regras YARA locais aprovadas).",
      "planned_actions": [
        "executar apenas ferramentas de seguranca locais e autorizadas",
        "avaliar analise de reputacao somente sob autorizacao humana separada",
        "nao enviar o binario a nenhum servico externo automaticamente"
      ],
      "does_not_materialize_binary": true,
      "required_evidence": [
        "resultado das verificacoes locais (a ser preenchido no futuro)",
        "lista de ferramentas locais utilizadas"
      ],
      "human_decision_required": true,
      "exit_options": ["GATE_PASSED", "GATE_FAILED", "STOP_PATH"],
      "does_not_authorize": [
        "enviar o binario a servico externo, sandbox publica, nuvem, LLM, repositorio, issue, chat ou storage externo"
      ],
      "must_remain_false": ["external_reputation_upload_authorized"],
      "notes": "Qualquer envio externo exige gate humano separado com avaliacao de propriedade intelectual e privacidade."
    },
    {
      "gate_id": 6,
      "gate_name": "Preparacao da sandbox",